{
  "type": "image",
  "mid": 42,
  "title": "Example image",
  "src": "https://www.example.com/sites/default/files/example.jpg",
  "originalSrc": "https://www.example.com/sites/default/files/example.jpg",
  "originalRevision": "42-1710000000-293400",
  "alt": "Two people reviewing a design together",
  "width": 1600,
  "height": 900,
  "deliveryProfile": "container",
  "loading": "lazy",
  "fetchpriority": "auto",
  "credit": "Photo: Stir Studios",
  "link": "https://www.example.com/work/example",
  "rel": "noopener",
  "category": "Work"
}
