{
  "type": "image",
  "mid": 42,
  "title": "Example card image",
  "src": "https://www.example.com/sites/default/files/example.jpg",
  "originalSrc": "https://www.example.com/sites/default/files/example.jpg",
  "originalRevision": "42-1710000000-293400",
  "alt": "Two people reviewing a design together",
  "width": 1600,
  "height": 900,
  "deliveryProfile": "card",
  "loading": "lazy",
  "fetchpriority": "auto"
}
